{
  "$schema": "http://json-schema.org/draft-07/schema#",
  "$id": "https://kingin-yellows.dev/schemas/plugin.schema.json",
  "title": "Claude Code Plugin Manifest Schema",
  "description": "Schema for Claude Code plugin.json files. Requires official fields (name, description, author) and allows optional metadata fields.",
  "type": "object",
  "required": ["name", "version", "description", "author"],
  "definitions": {
    "userConfigEntry": {
      "type": "object",
      "properties": {
        "type": {
          "type": "string",
          "enum": ["string", "number", "boolean", "directory", "file"]
        },
        "title": {
          "type": "string",
          "minLength": 1,
          "description": "Human-readable label shown in the Claude Code setup UI when prompting for this value. Required by the Claude Code remote validator (claude doctor); absence causes a manifest-rejection at install time."
        },
        "description": { "type": "string" },
        "default": {
          "description": "Default value. Must match the declared `type` (string|number|boolean for value types; string for directory/file path types). Constrained via allOf below to prevent a string default containing shell metacharacters from being interpolated unsafely into monitor.command via ${user_config.KEY}."
        },
        "required": { "type": "boolean" },
        "sensitive": {
          "type": "boolean",
          "default": false,
          "description": "Store value in OS keychain when true."
        }
      },
      "required": ["type", "title"],
      "additionalProperties": false,
      "allOf": [
        {
          "if": { "properties": { "type": { "const": "string" } }, "required": ["type"] },
          "then": { "properties": { "default": { "type": "string" } } }
        },
        {
          "if": { "properties": { "type": { "const": "number" } }, "required": ["type"] },
          "then": { "properties": { "default": { "type": "number" } } }
        },
        {
          "if": { "properties": { "type": { "const": "boolean" } }, "required": ["type"] },
          "then": { "properties": { "default": { "type": "boolean" } } }
        },
        {
          "if": { "properties": { "type": { "const": "directory" } }, "required": ["type"] },
          "then": { "properties": { "default": { "type": "string" } } }
        },
        {
          "if": { "properties": { "type": { "const": "file" } }, "required": ["type"] },
          "then": { "properties": { "default": { "type": "string" } } }
        }
      ]
    },
    "relativeDir": {
      "type": "string",
      "description": "Plugin-relative directory path. The leading './' is optional. A trailing '/' is optional when no segment contains '.', and is required when any segment does (so dir paths like './output.styles/' or './v2.0-agents/' must end in '/' to disambiguate from file paths like './foo.md'). Examples: './agents', './agents/', './output.styles/', 'output-styles'.",
      "pattern": "^(?:\\./)?(?!.*\\.\\.)(?:(?:[A-Za-z0-9_-]+/)*[A-Za-z0-9_-]+/?|(?:[A-Za-z0-9._-]+/)+)$"
    },
    "relativeFile": {
      "type": "string",
      "description": "Plugin-relative file path. The leading './' is optional. Must end in an extension '.<ext>' (so directory paths are rejected). Examples: './hooks/hooks.json', './.lsp.json', './hooks/v2.config.json'.",
      "pattern": "^(?:\\./)?(?!.*\\.\\.)[A-Za-z0-9._/-]+\\.[A-Za-z0-9]+$"
    },
    "dirOrDirs": {
      "description": "A single directory path or array of directory paths.",
      "oneOf": [
        { "$ref": "#/definitions/relativeDir" },
        {
          "type": "array",
          "items": { "$ref": "#/definitions/relativeDir" },
          "minItems": 1
        }
      ]
    },
    "fileFilesOrInline": {
      "description": "A single file path, an array mixing file paths and inline-object entries, or a single inline object.",
      "oneOf": [
        { "$ref": "#/definitions/relativeFile" },
        {
          "type": "array",
          "items": {
            "oneOf": [
              { "$ref": "#/definitions/relativeFile" },
              { "type": "object", "minProperties": 1 }
            ]
          },
          "minItems": 1
        },
        { "type": "object", "minProperties": 1 }
      ]
    },
    "inlineHooks": {
      "description": "Inline hooks only. This is a local policy decision, not a remote-validator requirement — a 2026-07-16 spike found Claude Code 2.1.211 accepts a file-path string for \"hooks\". This repo still requires hooks to be an inline object keyed by event name (PreToolUse, PostToolUse, Stop, ...) or an array of such inline objects. See docs/solutions/build-errors/claude-code-plugin-manifest-validation-errors.md and ci-schema-drift-hooks-inline-vs-string.md (2026-07-16 addendum) for history.",
      "oneOf": [
        { "type": "object", "minProperties": 1 },
        {
          "type": "array",
          "items": { "type": "object", "minProperties": 1 },
          "minItems": 1
        }
      ]
    }
  },
  "properties": {
    "$schema": {
      "type": "string",
      "format": "uri",
      "description": "Optional pointer to the official Claude Code plugin manifest schema (https://json.schemastore.org/claude-code-plugin-manifest.json). Claude Code's plugin loader ignores this field at load time per the official docs; editors and IDEs use it for autocomplete and inline validation. Declared here so additionalProperties:false at root does not reject it if AJV is later wired against real plugin manifests."
    },
    "name": {
      "type": "string",
      "pattern": "^[a-z0-9-]+$",
      "minLength": 1,
      "maxLength": 64,
      "description": "Plugin identifier in kebab-case. Must match directory name."
    },
    "version": {
      "type": "string",
      "pattern": "^[0-9]+\\.[0-9]+\\.[0-9]+$",
      "description": "Semantic version (MAJOR.MINOR.PATCH)."
    },
    "description": {
      "type": "string",
      "minLength": 10,
      "maxLength": 280,
      "description": "Brief plugin description (10-280 characters)."
    },
    "author": {
      "oneOf": [
        {
          "type": "string",
          "minLength": 1
        },
        {
          "type": "object",
          "required": ["name"],
          "properties": {
            "name": {
              "type": "string",
              "minLength": 1,
              "maxLength": 100
            },
            "email": {
              "type": "string",
              "format": "email"
            },
            "url": {
              "type": "string",
              "format": "uri"
            }
          },
          "additionalProperties": false
        }
      ],
      "description": "Author name (string) or object with name, email, url."
    },
    "license": {
      "type": "string",
      "maxLength": 50,
      "description": "SPDX license identifier."
    },
    "homepage": {
      "type": "string",
      "format": "uri",
      "description": "Plugin homepage URL."
    },
    "repository": {
      "type": "string",
      "format": "uri",
      "description": "Source repository URL (string only). Claude Code's remote validator rejects the npm-style object form ({\"type\":\"git\",\"url\":\"...\"}) with 'repository: Invalid input: expected string, received object'. See docs/solutions/build-errors/claude-code-plugin-manifest-validation-errors.md."
    },
    "keywords": {
      "type": "array",
      "items": {
        "type": "string",
        "pattern": "^[a-z0-9-]+$",
        "minLength": 2,
        "maxLength": 32
      },
      "maxItems": 10,
      "uniqueItems": true,
      "description": "Searchable keywords in kebab-case."
    },
    "mcpServers": {
      "description": "MCP server configurations: relative file path, array of paths/inline objects, or inline object keyed by server name.",
      "allOf": [{ "$ref": "#/definitions/fileFilesOrInline" }]
    },
    "hooks": {
      "description": "Inline hooks configuration keyed by event name (PreToolUse, PostToolUse, Stop, etc.), or an array of inline hook objects. File-path indirection is disallowed by this repo's local policy, not by the Claude Code remote validator — see docs/solutions/build-errors/ci-schema-drift-hooks-inline-vs-string.md.",
      "allOf": [{ "$ref": "#/definitions/inlineHooks" }]
    },
    "outputStyles": {
      "description": "Directory or array of directories containing markdown output style files (replaces default ./output-styles/).",
      "allOf": [{ "$ref": "#/definitions/dirOrDirs" }]
    },
    "commands": {
      "description": "Directory or array of directories containing slash command markdown files (replaces default ./commands/).",
      "allOf": [{ "$ref": "#/definitions/dirOrDirs" }]
    },
    "agents": {
      "description": "Directory or array of directories containing agent markdown files (replaces default ./agents/).",
      "allOf": [{ "$ref": "#/definitions/dirOrDirs" }]
    },
    "skills": {
      "description": "Directory or array of directories containing per-skill SKILL.md subdirectories (replaces default ./skills/).",
      "allOf": [{ "$ref": "#/definitions/dirOrDirs" }]
    },
    "lspServers": {
      "description": "LSP server configurations: relative file path, array of paths/inline objects, or inline object keyed by language/server name.",
      "allOf": [{ "$ref": "#/definitions/fileFilesOrInline" }]
    },
    "monitors": {
      "oneOf": [
        { "$ref": "#/definitions/relativeFile" },
        {
          "type": "array",
          "items": {
            "type": "object",
            "required": ["name", "command", "description"],
            "properties": {
              "name": {
                "type": "string",
                "pattern": "^[A-Za-z0-9_-]+$",
                "description": "Identifier unique within the plugin."
              },
              "command": {
                "type": "string",
                "minLength": 1,
                "description": "Shell command run as a persistent background process. SECURITY: ${user_config.KEY} substitutions are untrusted shell arguments. SAFE PATTERN: Pass values to a wrapper script via environment variables (e.g., ${CLAUDE_PLUGIN_OPTION_KEY}). UNSAFE PATTERN: Direct interpolation into the command string is vulnerable to shell injection; even single-quoting '${user_config.KEY}' can be bypassed if the value contains a single quote. The userConfigEntry.default constraint helps mitigate malicious defaults, but does not protect against user-supplied values."
              },
              "description": {
                "type": "string",
                "minLength": 1,
                "description": "Short summary shown in the task panel and notifications."
              },
              "when": {
                "type": "string",
                "pattern": "^(always|on-skill-invoke:[A-Za-z0-9_-]+)$",
                "description": "When the monitor starts: 'always' (default) or 'on-skill-invoke:<skill-name>'."
              }
            },
            "additionalProperties": false
          },
          "minItems": 1
        }
      ],
      "description": "Background monitor configurations: relative path string or inline array of monitor entries."
    },
    "userConfig": {
      "type": "object",
      "description": "Config keys prompted at install time. Values substituted as ${user_config.KEY} and exported as CLAUDE_PLUGIN_OPTION_<KEY> env vars. Each entry must declare type and title (required by the Claude Code remote validator), and may declare description, default, required, sensitive.",
      "propertyNames": {
        "pattern": "^[A-Za-z_][A-Za-z0-9_]*$"
      },
      "additionalProperties": { "$ref": "#/definitions/userConfigEntry" }
    },
    "channels": {
      "type": "array",
      "items": {
        "type": "object",
        "required": ["server"],
        "properties": {
          "server": {
            "type": "string",
            "minLength": 1,
            "description": "Name of an MCP server defined in this plugin's mcpServers."
          },
          "userConfig": {
            "type": "object",
            "propertyNames": {
              "pattern": "^[A-Za-z_][A-Za-z0-9_]*$"
            },
            "additionalProperties": { "$ref": "#/definitions/userConfigEntry" }
          }
        },
        "additionalProperties": false
      },
      "minItems": 1,
      "description": "Channel declarations for message injection (Telegram, Slack, Discord style). Each binds to an MCP server in this plugin. Note: server name cross-reference to mcpServers cannot be enforced in JSON Schema and must be validated at runtime."
    },
    "dependencies": {
      "type": "array",
      "items": {
        "oneOf": [
          {
            "type": "string",
            "minLength": 1,
            "description": "Plugin name (any version)."
          },
          {
            "type": "object",
            "required": ["name"],
            "properties": {
              "name": {
                "type": "string",
                "minLength": 1
              },
              "version": {
                "type": "string",
                "minLength": 1,
                "pattern": "^[~^>=<*xXvV0-9]",
                "semverRange": true,
                "description": "Semver range constraint such as ^1.2.0, ~2.1.0, >=3.0.0, or v1.2.3. Two-layer validation: the `pattern` is a lightweight structural gate that rejects unsupported leading characters before the keyword runs; `semverRange` then calls semver.validRange() for full semantic correctness. minLength: 1 guards the empty-string case — semver.validRange(\"\") returns \"*\" (truthy) so the keyword alone would accept it."
              },
              "optional": {
                "type": "boolean",
                "default": false,
                "description": "When true, the validator does not warn if this dep is missing from .claude-plugin/marketplace.json. Mirrors npm peerDependenciesMeta `optional: true` semantics: declared as a soft dep for documentation/audit purposes, not hard-required at install time. Hard deps (default `false` or omitted) trigger a WARNING (not ERROR) when missing from the catalog."
              },
              "reason": {
                "type": "string",
                "minLength": 1,
                "description": "Informational free-text explaining why this plugin is required — typically the specific MCP tool, command, or capability the consumer relies on. Content is not semantically validated (any non-empty string is accepted; minLength: 1 rejects only \"\"); intended as an audit trail readable by humans and AI reviewers. No equivalent field exists in npm/VS Code/JetBrains plugin schemas; this is a yellow-plugins extension."
              }
            },
            "additionalProperties": false
          }
        ]
      },
      "minItems": 1,
      "description": "Other plugins this plugin requires, optionally with semver version constraints. Each entry may also declare `optional: true` (soft dep — no warning if missing from marketplace catalog) and `reason: \"<text>\"` (audit trail explaining the specific MCP tool, command, or capability the consumer uses from this dep)."
    }
  },
  "additionalProperties": false
}
