{
  "name": "extended-example",
  "version": "2.1.0",
  "description": "Extended plugin manifest example exercising all optional component path, monitor, channel, dependency, lspServer, and userConfig fields supported by the schema.",
  "author": {
    "name": "KingInYellows",
    "email": "dev@example.com",
    "url": "https://github.com/KingInYellows"
  },
  "homepage": "https://github.com/KingInYellows/yellow-plugins",
  "repository": "https://github.com/KingInYellows/yellow-plugins",
  "license": "MIT",
  "keywords": ["example", "extended", "schema-coverage"],
  "skills": ["./skills/", "./extra-skills/"],
  "commands": "./commands/",
  "agents": ["./agents/", "./vendored-agents/"],
  "outputStyles": "./styles/",
  "hooks": {
    "PreToolUse": [
      {
        "matcher": "Bash",
        "hooks": [
          {
            "type": "command",
            "command": "bash \"${CLAUDE_PLUGIN_ROOT}/hooks/scripts/pre-bash.sh\"",
            "timeout": 5000
          }
        ]
      }
    ]
  },
  "mcpServers": {
    "telegram": {
      "command": "${CLAUDE_PLUGIN_ROOT}/servers/telegram",
      "args": ["--mode", "stream"]
    }
  },
  "lspServers": "./.lsp.json",
  "monitors": [
    {
      "name": "deploy-status",
      "command": "${CLAUDE_PLUGIN_ROOT}/scripts/poll-deploy.sh",
      "description": "Deployment status changes. SAFE PATTERN: pass user_config values to the wrapper script via the ${CLAUDE_PLUGIN_OPTION_<KEY>} environment variables exported by Claude Code. The wrapper reads them as ${API_ENDPOINT:?} or similar and passes them as literal argv entries — never as shell-interpolated strings. UNSAFE PATTERN: writing 'poll-deploy.sh ${user_config.api_endpoint}' (or even single-quoted '${user_config.api_endpoint}') interpolates the value into the shell command string before execution; a value containing a single quote breaks out of the quoting and achieves command injection."
    },
    {
      "name": "error-log",
      "command": "tail -F ./logs/error.log",
      "description": "Application error log",
      "when": "on-skill-invoke:debug"
    }
  ],
  "userConfig": {
    "api_endpoint": {
      "type": "string",
      "title": "API endpoint",
      "description": "Your team's API endpoint",
      "required": true,
      "sensitive": false
    },
    "api_token": {
      "type": "string",
      "title": "API token",
      "description": "API authentication token",
      "required": true,
      "sensitive": true
    },
    "timeout_ms": {
      "type": "number",
      "title": "Request timeout",
      "default": 5000,
      "sensitive": false
    }
  },
  "channels": [
    {
      "server": "telegram",
      "userConfig": {
        "bot_token": {
          "type": "string",
          "title": "Telegram bot token",
          "description": "Telegram bot token",
          "sensitive": true
        },
        "owner_id": {
          "type": "string",
          "title": "Telegram owner ID",
          "description": "Your Telegram user ID",
          "sensitive": false
        }
      }
    }
  ],
  "dependencies": [
    "helper-lib",
    { "name": "secrets-vault", "version": "~2.1.0" },
    { "name": "metrics-collector", "version": "^1.0.0" }
  ]
}
