{
  "name": "yellow-starter",
  "version": "1.0.0",
  "description": "Starter plugin demonstrating the yellow-plugins marketplace structure",
  "author": {
    "name": "KingInYellows",
    "url": "https://github.com/kinginyellow"
  },
  "homepage": "https://github.com/kinginyellow/yellow-plugins",
  "repository": "https://github.com/kinginyellow/yellow-plugins",
  "license": "MIT",
  "keywords": ["starter", "example", "template"]
}
