{
  "$schema": "https://json.schemastore.org/claude-code-plugin-manifest.json",
  "name": "yellow-docs",
  "version": "1.4.1",
  "description": "Documentation audit, generation, and Mermaid diagram creation for any repository",
  "author": {
    "name": "KingInYellows",
    "url": "https://github.com/KingInYellows"
  },
  "homepage": "https://github.com/KingInYellows/yellow-plugins#yellow-docs",
  "repository": "https://github.com/KingInYellows/yellow-plugins",
  "license": "MIT",
  "keywords": [
    "documentation",
    "docs",
    "mermaid",
    "audit",
    "generation"
  ]
}
