{
  "$schema": "https://json.schemastore.org/claude-code-plugin-manifest.json",
  "name": "yellow-browser-test",
  "version": "1.1.12",
  "description": "Autonomous web app testing with agent-browser — auto-discovery, structured flows, exploratory testing, and bug reporting",
  "author": {
    "name": "KingInYellows",
    "url": "https://github.com/KingInYellows"
  },
  "homepage": "https://github.com/KingInYellows/yellow-plugins#yellow-browser-test",
  "repository": "https://github.com/KingInYellows/yellow-plugins",
  "license": "MIT",
  "keywords": [
    "browser",
    "e2e",
    "agent-browser",
    "autonomous-qa"
  ]
}
