{
  "$schema": "https://json.schemastore.org/claude-code-plugin-manifest.json",
  "name": "yellow-ruvector",
  "version": "2.0.4",
  "description": "Persistent vector memory and semantic code search for Claude Code agents via ruvector",
  "author": {
    "name": "KingInYellows",
    "url": "https://github.com/KingInYellows"
  },
  "homepage": "https://github.com/KingInYellows/yellow-plugins#yellow-ruvector",
  "repository": "https://github.com/KingInYellows/yellow-plugins",
  "license": "MIT",
  "keywords": [
    "vector-search",
    "agent-memory",
    "semantic-search",
    "embeddings",
    "self-learning"
  ],
  "mcpServers": {
    "ruvector": {
      "command": "${CLAUDE_PLUGIN_ROOT}/bin/start-ruvector.sh",
      "args": [],
      "env": {
        "RUVECTOR_MCP_ALLOW": "hooks_capabilities,hooks_pretrain,hooks_recall,hooks_remember,hooks_stats"
      }
    }
  },
  "hooks": {
    "PreToolUse": [
      {
        "matcher": "Edit|Write|MultiEdit",
        "hooks": [
          {
            "type": "command",
            "command": "bash \"${CLAUDE_PLUGIN_ROOT}/hooks/scripts/pre-tool-use.sh\"",
            "timeout": 1
          }
        ]
      }
    ],
    "SessionStart": [
      {
        "matcher": "*",
        "hooks": [
          {
            "type": "command",
            "command": "bash \"${CLAUDE_PLUGIN_ROOT}/hooks/scripts/prewarm.sh\"",
            "timeout": 5
          },
          {
            "type": "command",
            "command": "bash \"${CLAUDE_PLUGIN_ROOT}/hooks/scripts/session-start.sh\"",
            "timeout": 6
          }
        ]
      }
    ],
    "PostToolUse": [
      {
        "matcher": "Edit|Write|MultiEdit",
        "hooks": [
          {
            "type": "command",
            "command": "bash \"${CLAUDE_PLUGIN_ROOT}/hooks/scripts/post-tool-use.sh\"",
            "timeout": 1
          }
        ]
      }
    ]
  }
}
