{
  "$schema": "https://json.schemastore.org/claude-code-plugin-manifest.json",
  "name": "yellow-composio",
  "version": "3.0.1",
  "description": "Optional Composio accelerator for batch workflows with usage tracking",
  "author": {
    "name": "KingInYellows",
    "url": "https://github.com/KingInYellows"
  },
  "homepage": "https://github.com/KingInYellows/yellow-plugins#yellow-composio",
  "repository": "https://github.com/KingInYellows/yellow-plugins",
  "license": "MIT",
  "keywords": [
    "composio",
    "batch-processing",
    "workbench",
    "usage-tracking",
    "mcp"
  ],
  "mcpServers": {
    "composio-server": {
      "type": "http",
      "url": "https://connect.composio.dev/mcp"
    }
  }
}
