{
  "$schema": "https://json.schemastore.org/claude-code-plugin-manifest.json",
  "name": "yellow-council",
  "version": "0.5.0",
  "description": "On-demand cross-lineage code review fanning out to an in-process Claude reviewer plus the Codex, Gemini, and OpenCode CLIs in parallel for advisory consensus",
  "author": {
    "name": "KingInYellows",
    "url": "https://github.com/KingInYellows"
  },
  "homepage": "https://github.com/KingInYellows/yellow-plugins#yellow-council",
  "repository": "https://github.com/KingInYellows/yellow-plugins",
  "license": "MIT",
  "keywords": [
    "council",
    "multi-llm",
    "code-review",
    "cross-lineage",
    "gemini",
    "opencode",
    "codex",
    "advisory"
  ],
  "dependencies": [
    {
      "name": "yellow-core",
      "version": ">=2.8.0",
      "optional": false,
      "reason": "quote-ground.sh batch is the Tier 1 evidence check; validate-fs.sh and compound-staging.sh back the citation parse and the Tier 2 redaction"
    }
  ]
}
