{
  "name": "hookify",
  "version": "1.2.3",
  "description": "Create hooks to prevent unwanted AI behaviors through conversation analysis and explicit rules",
  "author": {
    "name": "KingInYellows",
    "email": "dev@example.com",
    "url": "https://github.com/KingInYellows"
  },
  "homepage": "https://github.com/KingInYellows/yellow-plugins",
  "repository": "https://github.com/KingInYellows/yellow-plugins.git",
  "license": "MIT",
  "keywords": ["hooks", "behavior", "safety", "ai-control", "conversation-analysis"]
}
