{
  "$schema": "https://json.schemastore.org/claude-code-plugin-manifest.json",
  "name": "yellow-review",
  "version": "3.13.0",
  "description": "Multi-agent PR review with adaptive agent selection, parallel comment resolution, and sequential stack review. Graphite-native workflow.",
  "author": {
    "name": "KingInYellows",
    "url": "https://github.com/KingInYellows"
  },
  "homepage": "https://github.com/KingInYellows/yellow-plugins#yellow-review",
  "repository": "https://github.com/KingInYellows/yellow-plugins",
  "license": "MIT",
  "keywords": [
    "pr",
    "code-review",
    "graphite"
  ],
  "outputStyles": "./output-styles",
  "hooks": {
    "SessionStart": [
      {
        "matcher": "*",
        "hooks": [
          {
            "type": "command",
            "command": "bash \"${CLAUDE_PLUGIN_ROOT}/hooks/scripts/session-start.sh\"",
            "timeout": 3
          }
        ]
      }
    ]
  },
  "dependencies": [
    {
      "name": "yellow-core",
      "version": "*",
      "optional": false,
      "reason": "lib/review-ledger.sh sources cs_redact_secrets from yellow-core/lib/compound-staging.sh; without it the review ledger withholds every model-authored string"
    },
    {
      "name": "yellow-linear",
      "version": "*",
      "optional": true,
      "reason": "review:resolve files follow-up issues with mcp__plugin_yellow-linear_linear__save_issue and dedupes with list_issues"
    }
  ]
}
