{
  "$schema": "https://json.schemastore.org/claude-code-plugin-manifest.json",
  "name": "yellow-codex",
  "version": "0.5.0",
  "description": "OpenAI Codex CLI wrapper with review, rescue, and analysis agents for workflow integration",
  "author": {
    "name": "KingInYellows",
    "url": "https://github.com/KingInYellows"
  },
  "homepage": "https://github.com/KingInYellows/yellow-plugins#yellow-codex",
  "repository": "https://github.com/KingInYellows/yellow-plugins",
  "license": "MIT",
  "keywords": [
    "codex",
    "openai",
    "code-review",
    "ai-agent",
    "rescue",
    "analysis"
  ]
}
