{
  "name": "yellow-chatprd",
  "version": "1.3.1",
  "description": "ChatPRD MCP integration with document management workflows and Linear bridging for Claude Code",
  "author": {
    "name": "KingInYellows",
    "url": "https://github.com/KingInYellows"
  },
  "homepage": "https://github.com/KingInYellows/yellow-plugins#yellow-chatprd",
  "repository": "https://github.com/KingInYellows/yellow-plugins",
  "license": "MIT",
  "keywords": [
    "chatprd",
    "prd",
    "product-management",
    "documentation",
    "linear"
  ],
  "mcpServers": {
    "chatprd": {
      "type": "http",
      "url": "https://app.chatprd.ai/mcp"
    }
  },
  "dependencies": [
    {
      "name": "yellow-linear",
      "version": "*",
      "optional": true,
      "reason": "chatprd:link-linear uses mcp__plugin_yellow-linear_linear__create_issue"
    }
  ]
}
