{
  "$schema": "https://json.schemastore.org/claude-code-plugin-manifest.json",
  "name": "yellow-mempalace",
  "version": "1.1.8",
  "description": "Structured long-term memory with temporal knowledge graph via MemPalace",
  "author": {
    "name": "KingInYellows",
    "url": "https://github.com/KingInYellows"
  },
  "homepage": "https://github.com/KingInYellows/yellow-plugins#yellow-mempalace",
  "repository": "https://github.com/KingInYellows/yellow-plugins",
  "license": "MIT",
  "keywords": [
    "memory",
    "knowledge-graph",
    "ai-memory",
    "mcp",
    "chromadb"
  ],
  "mcpServers": {
    "mempalace": {
      "command": "mempalace-mcp",
      "args": [],
      "env": {
        "PYTHONWARNINGS": "ignore",
        "TRANSFORMERS_VERBOSITY": "error",
        "TOKENIZERS_PARALLELISM": "false"
      }
    }
  }
}
