{
  "$schema": "https://json.schemastore.org/claude-code-plugin-manifest.json",
  "name": "yellow-jules",
  "version": "0.4.2",
  "description": "Google Jules integration (deprecated: Jules is read-only from 2026-11-11 and shuts down 2026-12-31) — delegate, supervise, and review Jules remote-agent sessions under owner-written grants",
  "author": {
    "name": "KingInYellows",
    "url": "https://github.com/KingInYellows"
  },
  "homepage": "https://github.com/KingInYellows/yellow-plugins#yellow-jules",
  "repository": "https://github.com/KingInYellows/yellow-plugins",
  "license": "MIT",
  "keywords": [
    "jules",
    "google",
    "remote-agent",
    "delegation",
    "ai-agent",
    "automation"
  ]
}
